{
  "team_name": "code-review",
  "workflow_type": "review",
  "project_root": "__PROJECT_ROOT__",
  "session_id": "test-session-001",
  "created_at": "2026-02-10T12:00:00Z",
  "budget_max_usd": 2.00,
  "budget_remaining_usd": 2.00,
  "warning_threshold_usd": 0.50,
  "status": "pending",
  "waves": [
    {
      "wave_number": 1,
      "description": "Parallel code review by specialist reviewers",
      "members": [
        {
          "name": "backend-review",
          "agent": "backend-reviewer",
          "model": "haiku",
          "stdin_file": "stdin-backend-review.json",
          "stdout_file": "stdout-backend-review.json",
          "status": "pending",
          "cost_usd": 0,
          "cost_status": "",
          "error_message": "",
          "retry_count": 0,
          "max_retries": 1,
          "timeout_ms": 600000
        },
        {
          "name": "frontend-review",
          "agent": "frontend-reviewer",
          "model": "haiku",
          "stdin_file": "stdin-frontend-review.json",
          "stdout_file": "stdout-frontend-review.json",
          "status": "pending",
          "cost_usd": 0,
          "cost_status": "",
          "error_message": "",
          "retry_count": 0,
          "max_retries": 1,
          "timeout_ms": 600000
        },
        {
          "name": "standards-review",
          "agent": "standards-reviewer",
          "model": "haiku",
          "stdin_file": "stdin-standards-review.json",
          "stdout_file": "stdout-standards-review.json",
          "status": "pending",
          "cost_usd": 0,
          "cost_status": "",
          "error_message": "",
          "retry_count": 0,
          "max_retries": 1,
          "timeout_ms": 600000
        }
      ],
      "on_complete_script": null
    }
  ]
}
