{
  "team_name": "implementation",
  "workflow_type": "implementation",
  "project_root": "__PROJECT_ROOT__",
  "session_id": "test-session-002",
  "created_at": "2026-02-10T12:00:00Z",
  "budget_max_usd": 5.00,
  "budget_remaining_usd": 5.00,
  "warning_threshold_usd": 1.00,
  "status": "pending",
  "waves": [
    {
      "wave_number": 1,
      "description": "Core implementation",
      "members": [
        {
          "name": "task-001-main",
          "agent": "go-pro",
          "model": "sonnet",
          "stdin_file": "stdin-task-001.json",
          "stdout_file": "stdout-task-001.json",
          "status": "pending",
          "cost_usd": 0,
          "cost_status": "",
          "error_message": "",
          "retry_count": 0,
          "max_retries": 1,
          "timeout_ms": 600000
        }
      ],
      "on_complete_script": null
    },
    {
      "wave_number": 2,
      "description": "Tests (depends on wave 1 output)",
      "members": [
        {
          "name": "task-002-tests",
          "agent": "go-pro",
          "model": "sonnet",
          "stdin_file": "stdin-task-002.json",
          "stdout_file": "stdout-task-002.json",
          "status": "pending",
          "cost_usd": 0,
          "cost_status": "",
          "error_message": "",
          "retry_count": 0,
          "max_retries": 1,
          "timeout_ms": 600000
        }
      ],
      "on_complete_script": null
    }
  ]
}
